{
  "$schema": "../../public/schemas/plugin.schema.json",
  "name": "串口监视器",
  "version": "1.0.0",
  "icon": "resources/icon.png",
  "description": "LinkDesk 第一个视图插件——通用容器基础设施在此验证。数据收发终端，接收区（CM6）+ 发送栏（Monaco）+ 侧栏设置。不绑定任何特定用途。",
  "author": "官方",
  "entry": "src/index.tsx",
  "sidebar": "src/sidebar.tsx",
  "iconLocation": "top",
  "viewRole": "sidebarPrimary",
  "tabBehavior": {
    "confirmOnClose": "关闭此标签页将断开串口连接",
    "invokeBeforeClose": "close_port"
  },
  "statusBar": [
    { "id": "connection", "icon": "circle-filled", "label": "", "align": "left" },
    { "id": "stats", "label": "TX:0  RX:0", "align": "left" }
  ],
  "contributes": {
    "configuration": {
      "title": "串口监视器",
      "properties": {
        "serial-monitor.statusBar.txrx": {
          "type": "boolean",
          "default": true,
          "description": "状态栏显示 TX/RX 计数"
        },
        "serial-monitor.statusBar.connection": {
          "type": "boolean",
          "default": true,
          "description": "状态栏显示连接状态指示灯"
        }
      }
    },
    "configurationDefaults": {
      "serial-monitor.statusBar.txrx": true,
      "serial-monitor.statusBar.connection": true
    },
    "commands": [
      { "id": "serial-monitor.copy", "title": "复制", "category": "串口监视器", "when": "activeEditor == 'serial-monitor'" },
      { "id": "serial-monitor.selectAll", "title": "全选", "category": "串口监视器", "when": "activeEditor == 'serial-monitor'" },
      { "id": "serial-monitor.clear", "title": "清空接收区", "category": "串口监视器", "when": "activeEditor == 'serial-monitor'" },
      { "id": "serial-monitor.clearSend", "title": "清空发送区", "category": "串口监视器", "when": "activeEditor == 'serial-monitor'" },
      { "id": "serial-monitor.togglePause", "title": "暂停接收", "category": "串口监视器", "when": "activeEditor == 'serial-monitor' && sourceOpen" },
      { "id": "serial-monitor.exportLog", "title": "导出日志", "category": "串口监视器", "when": "activeEditor == 'serial-monitor'" },
      { "id": "serial-monitor.toggleSendMode", "title": "切换到 HEX 发送", "category": "串口监视器", "when": "activeEditor == 'serial-monitor'" },
      { "id": "serial-monitor.toggleEcho", "title": "关闭消息回显", "category": "串口监视器", "when": "activeEditor == 'serial-monitor'" },
      { "id": "serial-monitor.toggleLineNumbers", "title": "隐藏行号", "category": "串口监视器", "when": "activeEditor == 'serial-monitor'" },
      { "id": "serial-monitor.quickSendFill", "title": "回填到发送区", "category": "串口监视器", "when": "activeEditor == 'serial-monitor'" },
      { "id": "serial-monitor.quickSendEdit", "title": "编辑", "category": "串口监视器", "when": "activeEditor == 'serial-monitor'" },
      { "id": "serial-monitor.quickSendDelete", "title": "删除", "category": "串口监视器", "when": "activeEditor == 'serial-monitor'" }
    ],
    "menus": {
      "editorContext": [
        { "command": "serial-monitor.copy", "group": "edit", "when": "activeEditor == 'serial-monitor'" },
        { "command": "serial-monitor.selectAll", "group": "edit", "when": "activeEditor == 'serial-monitor'" },
        { "command": "serial-monitor.clear", "group": "serial-monitor", "when": "activeEditor == 'serial-monitor'" },
        { "command": "serial-monitor.togglePause", "group": "serial-monitor", "when": "activeEditor == 'serial-monitor' && sourceOpen" }
      ],
      "quickSendContext": [
        { "command": "serial-monitor.quickSendFill", "group": "edit" },
        { "command": "serial-monitor.quickSendEdit", "group": "edit" },
        { "command": "serial-monitor.quickSendDelete", "group": "delete" }
      ],
      "commandPalette": [
        { "command": "serial-monitor.clear", "when": "activeEditor == 'serial-monitor'" },
        { "command": "serial-monitor.clearSend", "when": "activeEditor == 'serial-monitor'" },
        { "command": "serial-monitor.togglePause", "when": "activeEditor == 'serial-monitor' && sourceOpen" },
        { "command": "serial-monitor.exportLog", "when": "activeEditor == 'serial-monitor'" },
        { "command": "serial-monitor.toggleSendMode", "when": "activeEditor == 'serial-monitor'" },
        { "command": "serial-monitor.toggleEcho", "when": "activeEditor == 'serial-monitor'" },
        { "command": "serial-monitor.toggleLineNumbers", "when": "activeEditor == 'serial-monitor'" }
      ]
    }
  },
  "recommends": [
    { "plugin": "workspace", "reason": "配合卡片可视化串口数据" }
  ],
  "suggests": [
    { "plugin": "protocol-bracket", "reason": "协议解析——不装则只能查看原始数据" }
  ],
  "changelog": [
    { "version": "1.0.0", "date": "2026-07-19", "changes": ["初始发布", "串口工具栏", "CM6 接收区 + Monaco 发送栏", "侧栏设置（时间戳/编码/换行符）"] }
  ]
}
